{
  "schema_id": "https://t-understand.dev/schemas/integration-report.schema.json",
  "schema_version": "1.0.0",
  "status": "PASS",
  "scenarios": [
    {
      "id": "single-repo-complete-pipeline",
      "status": "PASS",
      "assertions": 1,
      "duration_ms": 8971
    },
    {
      "id": "monorepo-module-coverage",
      "status": "PASS",
      "assertions": 1,
      "duration_ms": 494
    },
    {
      "id": "multi-repo-contract-graph",
      "status": "PASS",
      "assertions": 1,
      "duration_ms": 1544
    },
    {
      "id": "diff-review-matrix",
      "status": "PASS",
      "assertions": 1,
      "duration_ms": 1962
    },
    {
      "id": "freshness-invalidation-refresh",
      "status": "PASS",
      "assertions": 1,
      "duration_ms": 1415
    },
    {
      "id": "platform-package-install-uninstall",
      "status": "PASS",
      "assertions": 1,
      "duration_ms": 1029
    },
    {
      "id": "cheap-model-contract-qualification",
      "status": "PASS",
      "assertions": 1,
      "duration_ms": 55
    }
  ],
  "checks": 7,
  "errors": [],
  "generated_at": "2026-07-21T17:04:45Z"
}
